date,ticker,headline,url,source,date_dt
2025-11-24,AAPL,Young people lack skills to manage their money – but the UK curriculum is finally catching up,https://uk.finance.yahoo.com/news/young-people-money-uk-government-education-curriculum-060024381.html?.tsrc=rss,Yahoo Finance,2025-11-24
2025-11-24,GOOGL,NATO and Google Cloud Sign Multi-Million Dollar Deal for AI-Enabled Sovereign Cloud,https://finance.yahoo.com/news/nato-google-cloud-sign-multi-070000162.html?.tsrc=rss,Yahoo Finance,2025-11-24
2025-11-24,MSFT,2 Mega-Cap Stocks to Consider Right Now and 1 We Question,https://finance.yahoo.com/news/2-mega-cap-stocks-consider-043615912.html?.tsrc=rss,Yahoo Finance,2025-11-24
2025-11-24,MSFT,Flood of AI Bonds Adds to Pressure on Markets,https://finance.yahoo.com/m/33372498-f9e3-3456-8fd4-0fc08fc23285/flood-of-ai-bonds-adds-to.html?.tsrc=rss,Yahoo Finance,2025-11-24
2025-11-24,NVDA,Stocks rise as US rate hopes soothe nerves after torrid week,https://finance.yahoo.com/news/asian-stocks-rise-us-rate-030527575.html?.tsrc=rss,Yahoo Finance,2025-11-24
2025-11-24,NVDA,Caterpillar Is Quietly Beating Nvidia Stock This Year. Should You Buy It?,https://www.fool.com/investing/2025/11/24/caterpillar-is-quietly-beating-nvidia-stock-this-y/?.tsrc=rss,Yahoo Finance,2025-11-24
2025-11-24,NVDA,Could Buying SoundHound AI Now Be Like Buying Nvidia in 2023?,https://www.fool.com/investing/2025/11/24/could-buying-soundhound-ai-now-be-like-buying-nvid/?.tsrc=rss,Yahoo Finance,2025-11-24
2025-11-24,NVDA,Revolut valued at $75 billion after secondary share sale,https://finance.yahoo.com/news/revolut-valued-75-billion-secondary-084609213.html?.tsrc=rss,Yahoo Finance,2025-11-24
2025-11-24,NVDA,Revolut share sale values London fintech giant at £57 billion,https://www.standard.co.uk/business/revolut-share-sale-london-fintech-giant-nvdia-b1259445.html?.tsrc=rss,Yahoo Finance,2025-11-24
2025-11-24,NVDA,Revolut Notches $75 Billion Valuation in Latest Share Sale,https://finance.yahoo.com/news/revolut-notches-75-billion-valuation-094617423.html?.tsrc=rss,Yahoo Finance,2025-11-24
2025-11-24,GOOGL,The Real AI Battle Isn't in Chips -- It's in Compute Efficiency. Here's the Stock Positioned to Win.,https://www.fool.com/investing/2025/11/23/the-real-ai-battle-isnt-chips-its-compute-efficien/?.tsrc=rss,Yahoo Finance,2025-11-24
2025-11-24,MSFT,Analysis-U.S. companies hold the line at climate talks despite Trump,https://finance.yahoo.com/news/analysis-u-companies-hold-line-060317445.html?.tsrc=rss,Yahoo Finance,2025-11-24
2025-11-24,GOOGL,Alphabet (GOOGL): Exploring Valuation After a 44% Surge in the Past Quarter,https://finance.yahoo.com/news/alphabet-googl-exploring-valuation-44-021018923.html?.tsrc=rss,Yahoo Finance,2025-11-24
2025-11-24,GOOGL,3 Top Tech Stocks to Buy in November,https://www.fool.com/investing/2025/11/23/3-top-tech-stocks-to-buy-in-november/?.tsrc=rss,Yahoo Finance,2025-11-24
2025-11-24,TSLA,1 Mega-Cap Stock on Our Watchlist and 2 We Brush Off,https://finance.yahoo.com/news/1-mega-cap-stock-watchlist-043535917.html?.tsrc=rss,Yahoo Finance,2025-11-24
2025-11-24,TSLA,I Would Buy Tesla Stock at This Price,https://www.fool.com/investing/2025/11/24/i-would-buy-tesla-stock-at-this-price/?.tsrc=rss,Yahoo Finance,2025-11-24
2025-11-24,TSLA,"Safe, Routine, Ready: Does That Spell the End for Tesla's Run-Up?",https://www.fool.com/investing/2025/11/24/safe-routine-ready-does-that-spell-the-end-for-tes/?.tsrc=rss,Yahoo Finance,2025-11-24
2025-11-24,AMZN,"2 No-Brainer Stocks to Buy With $50 Before 2026, According to Wall Street",https://www.fool.com/investing/2025/11/24/2-no-brainer-stocks-buy-50-before-2026-wall-street/?.tsrc=rss,Yahoo Finance,2025-11-24
2025-11-24,AMZN,‘She’s a thief. She’s a con. She’s a crook’: Former CEO of realtor group accused of stealing $81K plus. Here’s how,https://finance.yahoo.com/news/she-thief-she-con-she-153500797.html?.tsrc=rss,Yahoo Finance,2025-11-24
2025-11-24,AAPL,Everything you need to know about second charge mortgages,https://uk.finance.yahoo.com/news/second-charge-mortgages-property-060019263.html?.tsrc=rss,Yahoo Finance,2025-11-24
2025-11-24,MSFT,Google Has Been an AI Winner. What to Do With Alphabet Stock Now.,https://finance.yahoo.com/m/84d70911-2838-3e3c-90cb-28e3f60bbf1d/google-has-been-an-ai-winner..html?.tsrc=rss,Yahoo Finance,2025-11-24
2025-11-24,MSFT,Former Microsoft Executive Launches $250 Eyewear Brand For Girls After Daughter's Vision Crisis At Age 4,https://finance.yahoo.com/news/former-microsoft-executive-launches-250-010111438.html?.tsrc=rss,Yahoo Finance,2025-11-24
2025-11-24,MSFT,Could the Anthropic Partnership Be Nvidia's Most Important AI Deal Yet?,https://www.fool.com/investing/2025/11/24/could-the-anthropic-partnership-be-nvidias-most-im/?.tsrc=rss,Yahoo Finance,2025-11-24
2025-11-24,META,"China's power equipment firms ride AI-driven boom amid demand from US, emerging markets",https://finance.yahoo.com/news/chinas-power-equipment-firms-ride-093000413.html?.tsrc=rss,Yahoo Finance,2025-11-24
2025-11-24,AAPL,How to plan Black Friday shopping to avoid overspending,https://uk.finance.yahoo.com/news/black-friday-shopping-spending-amazon-060019679.html?.tsrc=rss,Yahoo Finance,2025-11-24
2025-11-24,AAPL,"This Is My Favorite Warren Buffett Stock, and It's One of His Biggest Bets (Hint: It's Not Apple or Alphabet)",https://www.fool.com/investing/2025/11/24/this-is-my-favorite-warren-buffett-stock-and-its-o/?.tsrc=rss,Yahoo Finance,2025-11-24
2025-11-24,AAPL,"Dow Jones Futures, Bitcoin Rise; Nvidia, Apple, Eli Lilly In Focus",https://finance.yahoo.com/m/8d419152-1254-303b-b245-e33cbbfa30b6/dow-jones-futures%2C-bitcoin.html?.tsrc=rss,Yahoo Finance,2025-11-24
2025-11-24,AAPL,These 3 Dow Stocks Are Set to Soar in 2026 and Beyond,https://www.fool.com/investing/2025/11/23/these-3-dow-stocks-are-set-to-soar-in-2026-and-bey/?.tsrc=rss,Yahoo Finance,2025-11-24
2025-11-24,META,Alibaba’s Main AI App Debuts Strongly in Effort to Rival ChatGPT,https://finance.yahoo.com/news/alibaba-main-ai-app-debuts-041113798.html?.tsrc=rss,Yahoo Finance,2025-11-24
2025-11-24,MSFT,Anthropic Will Spend $30 Billion on Azure. Could This Be Microsoft's Most Important AI Deal Yet?,https://www.fool.com/investing/2025/11/24/anthropic-spend-billion-azure-microsoft/?.tsrc=rss,Yahoo Finance,2025-11-24
2025-11-24,META,3 Volatile Stocks That Fall Short,https://finance.yahoo.com/news/3-volatile-stocks-fall-short-044513683.html?.tsrc=rss,Yahoo Finance,2025-11-24
2025-11-24,NVDA,Is XRP the Next Bitcoin?,https://www.fool.com/investing/2025/11/24/is-xrp-the-next-bitcoin/?.tsrc=rss,Yahoo Finance,2025-11-24
2025-11-24,NVDA,The Most Jaw-Dropping Number You May Have Missed From Nvidia's Latest Earnings Report,https://www.fool.com/investing/2025/11/24/the-most-jaw-dropping-number-you-may-have-missed-f/?.tsrc=rss,Yahoo Finance,2025-11-24
2025-11-24,NVDA,"Billionaire Stanley Druckenmiller Dropped Nvidia, Palantir, and Eli Lilly Over the Past Year and Just Bought the 2 Cheapest Magnificent Seven Stocks.",https://www.fool.com/investing/2025/11/23/billionaire-stanley-druckenmiller-dropped-nvidia-p/?.tsrc=rss,Yahoo Finance,2025-11-24
2025-11-24,NVDA,"If You'd Invested $100 in Nvidia 10 Years Ago, Here's How Much You'd Have Today",https://www.fool.com/investing/2025/11/23/if-youd-invested-100-in-nvidia-10-years-ago-heres/?.tsrc=rss,Yahoo Finance,2025-11-24
2025-11-24,NVDA,Asian shares mostly gain and US futures also advance after Wall St ends with gains,https://finance.yahoo.com/news/asian-shares-mostly-gain-us-042004957.html?.tsrc=rss,Yahoo Finance,2025-11-24
2025-11-23,NVDA,Why Nvidia Could Be a Bigger Winner in Quantum Computing Than You Might Think,https://www.fool.com/investing/2025/11/23/why-nvidia-could-be-a-bigger-winner-in-quantum-com/?.tsrc=rss,Yahoo Finance,2025-11-23
2025-11-23,META,Does Yann LeCun’s Departure and Rising AI Spend Shift the Bull Case for Meta Platforms (META)?,https://finance.yahoo.com/news/does-yann-lecun-departure-rising-091301797.html?.tsrc=rss,Yahoo Finance,2025-11-23
2025-11-23,AMZN,Street Calls of the Week,https://finance.yahoo.com/news/street-calls-week-094821233.html?.tsrc=rss,Yahoo Finance,2025-11-23
2025-11-23,AMZN,Black Friday battles: Why Walmart is still thumping Target,https://finance.yahoo.com/news/black-friday-battles-why-walmart-is-still-thumping-target-113007691.html?.tsrc=rss,Yahoo Finance,2025-11-23
2025-11-23,AMZN,Amazon.com (AMZN) Is Down 6.0% After $3 Billion AI Data Center Expansion Announcement - Has The Bull Case Changed?,https://finance.yahoo.com/news/amazon-com-amzn-down-6-081153157.html?.tsrc=rss,Yahoo Finance,2025-11-23
2025-11-23,AMZN,Fire alert: the fake ‘Amazon TV stick’ that opens the door to fraudsters,https://uk.finance.yahoo.com/news/fire-alert-fake-amazon-tv-070003055.html?.tsrc=rss,Yahoo Finance,2025-11-23
2025-11-23,AMZN,"If You Invested $10K In Meta Platforms Stock 10 Years Ago, How Much Would You Have Now?",https://finance.yahoo.com/news/invested-10k-meta-platforms-stock-030135443.html?.tsrc=rss,Yahoo Finance,2025-11-23
2025-11-23,META,3 Monster Stocks to Hold for the Next 3 Years,https://www.fool.com/investing/2025/11/23/3-monster-stocks-to-hold-for-the-next-3-years/?.tsrc=rss,Yahoo Finance,2025-11-23
2025-11-23,NVDA,"Jim Cramer Reiterates “You Need to Own NVIDIA, Not Trade It”",https://finance.yahoo.com/news/jim-cramer-reiterates-own-nvidia-195125682.html?.tsrc=rss,Yahoo Finance,2025-11-23
2025-11-23,TSLA,Could Buying Robinhood Stock Today Set You Up for Life?,https://www.fool.com/investing/2025/11/23/could-buying-robinhood-stock-today-set-you-up-for/?.tsrc=rss,Yahoo Finance,2025-11-23
2025-11-23,META,This Could Be the Most Undervalued AI Stock Heading Into 2026,https://www.fool.com/investing/2025/11/23/this-could-be-most-undervalued-ai-stock-into-2026/?.tsrc=rss,Yahoo Finance,2025-11-23
2025-11-23,META,2 Artificial Intelligence (AI) Stocks to Buy Before the End of 2025,https://www.fool.com/investing/2025/11/23/2-ai-stocks-buy-before-end-2025/?.tsrc=rss,Yahoo Finance,2025-11-23
2025-11-23,TSLA,"On-Chain Stocks Could Misprice Over Weekends, Triggering Arbitrage Risks: RedStone",https://www.coindesk.com/business/2025/11/23/on-chain-stocks-could-misprice-over-weekends-triggering-arbitrage-risks-redstone?.tsrc=rss,Yahoo Finance,2025-11-23
2025-11-23,TSLA,"Musk Says Tesla Nears AI5 Chip Tape Out, Starting Work on AI6",https://finance.yahoo.com/news/musk-says-tesla-nears-ai5-083013221.html?.tsrc=rss,Yahoo Finance,2025-11-23
2025-11-23,TSLA,Tesla Stock Just Hit a Wall -- The Reversal Says More Than the Rally,https://finance.yahoo.com/news/tesla-stock-just-hit-wall-161426596.html?.tsrc=rss,Yahoo Finance,2025-11-23
2025-11-23,TSLA,"TSLA Stock Price Prediction: Where Tesla Could Be by 2025, 2026, 2030",https://finance.yahoo.com/news/tsla-stock-price-prediction-where-130456912.html?.tsrc=rss,Yahoo Finance,2025-11-23
2025-11-23,AMZN,AI Ignites the Return of Bezos the Inventor,https://finance.yahoo.com/m/77b91bcc-b87e-37c8-9b10-123cd5d255a9/ai-ignites-the-return-of.html?.tsrc=rss,Yahoo Finance,2025-11-23
2025-11-23,AMZN,"Target, Amazon, and Home Depot face holiday sales boycott",https://www.thestreet.com/retail/target-amazon-and-home-depot-face-holiday-season-boycott?.tsrc=rss,Yahoo Finance,2025-11-23
2025-11-23,AMZN,"Why Meta Platforms, Inc. (META) Is Under Analyst Spotlight",https://finance.yahoo.com/news/why-meta-platforms-inc-meta-152632570.html?.tsrc=rss,Yahoo Finance,2025-11-23
2025-11-23,AAPL,"Ranking the Best ""Magnificent Seven"" Stocks to Buy for 2026. Here's My No. 7 Pick.",https://www.fool.com/investing/2025/11/23/ranking-magnificent-seven-stocks-buy-2026-seven/?.tsrc=rss,Yahoo Finance,2025-11-23
2025-11-23,MSFT,"Satoshi Nakamoto's Bitcoin Wealth Falls By $41 Billion, Now Poorer Than Bill Gates",https://decrypt.co/349658/satoshi-nakamoto-bitcoin-wealth-falls-41-billion-poorer-bill-gates?.tsrc=rss,Yahoo Finance,2025-11-23
2025-11-23,MSFT,Microsoft’s $80B AI shift: What it does to your money,https://www.thestreet.com/economy/microsofts-80b-ai-shift-what-it-does-to-your-money?.tsrc=rss,Yahoo Finance,2025-11-23
2025-11-23,MSFT,Will Alphabet Be the World's Next $5 Trillion Stock?,https://www.fool.com/investing/2025/11/23/will-alphabet-be-the-worlds-next-5-trillion-stock/?.tsrc=rss,Yahoo Finance,2025-11-23
2025-11-23,MSFT,The Great S&P 500 Shakeup: How Microsoft and Oracle Became the Last Giants Standing,https://247wallst.com/videos/the-great-sp-500-shakeup-how-microsoft-and-oracle-became-the-last-giants-standing/?.tsrc=rss,Yahoo Finance,2025-11-23
2025-11-23,MSFT,"Economic data returns, retail earnings feature in holiday-shortened week: What to watch this week",https://finance.yahoo.com/news/economic-data-returns-retail-earnings-feature-in-holiday-shortened-week-what-to-watch-this-week-123746898.html?.tsrc=rss,Yahoo Finance,2025-11-23
2025-11-23,MSFT,"Will Bitcoin Hit $250,000 by 2026? We Asked ChatGPT",https://www.ccn.com/news/crypto/will-bitcoin-hit-250000-by-2026-we-asked-chatgpt/?.tsrc=rss,Yahoo Finance,2025-11-23
2025-11-23,AMZN,"Here Is Jeff Bezos' Most Expensive Investment, And It Is The Largest In The World",https://finance.yahoo.com/news/jeff-bezos-most-expensive-investment-195046101.html?.tsrc=rss,Yahoo Finance,2025-11-23
2025-11-23,AAPL,Dionysus Health Appoints Digital Health Leader Rashmi Raghavendra as Chief Executive Officer,https://finance.yahoo.com/news/dionysus-health-appoints-digital-health-015500448.html?.tsrc=rss,Yahoo Finance,2025-11-23
2025-11-23,AAPL,Jim Cramer Believes Apple’s (AAPL) User Base Is Very Important For AI,https://finance.yahoo.com/news/jim-cramer-believes-apple-aapl-055351804.html?.tsrc=rss,Yahoo Finance,2025-11-23
2025-11-23,AAPL,'We lost 50kg between us and now own a £35m meal prep business',https://uk.finance.yahoo.com/news/prep-kitchen-healthy-meals-subscription-meal-delivery-060018743.html?.tsrc=rss,Yahoo Finance,2025-11-23
2025-11-23,AAPL,SoundHound AI Looks Unstoppable. Is It a Top AI Stock to Buy for 2026?,https://www.fool.com/investing/2025/11/23/is-soundhound-ai-a-top-stock-to-buy-for-2026/?.tsrc=rss,Yahoo Finance,2025-11-23
2025-11-23,AAPL,Should You Buy Alphabet Stock After Warren Buffett's New $4 Billion Bet?,https://www.fool.com/investing/2025/11/23/should-you-buy-alphabet-stock-after-warren-buffett/?.tsrc=rss,Yahoo Finance,2025-11-23
2025-11-23,AAPL,Taxpayers slapped with £321m bill for benefit claimants’ smartwatches and wobble boards,https://uk.finance.yahoo.com/news/taxpayers-slapped-321m-bill-benefit-162311426.html?.tsrc=rss,Yahoo Finance,2025-11-23
2025-11-23,AAPL,"5 Reasons I Still Love Apple Stock, Even After It Soared Higher",https://www.fool.com/investing/2025/11/23/5-reasons-i-still-love-apple-stock-even-after-it-s/?.tsrc=rss,Yahoo Finance,2025-11-23
2025-11-23,AAPL,Mark Gurman Says Tim Cook Likely To Remain As Apple CEO Through At Least Mid-2026,https://finance.yahoo.com/news/mark-gurman-says-tim-cook-205851696.html?.tsrc=rss,Yahoo Finance,2025-11-23
2025-11-23,MSFT,Will Arm’s Deepened Nvidia Partnership Shift the Competitive Balance in AI Data Centers for ARM?,https://finance.yahoo.com/news/arm-deepened-nvidia-partnership-shift-071106463.html?.tsrc=rss,Yahoo Finance,2025-11-23
2025-11-23,MSFT,2 Artificial Intelligence (AI) Stocks You Can Buy and Hold for the Next Decade,https://www.fool.com/investing/2025/11/22/2-artificial-intelligence-stocks-you-can-buy-and/?.tsrc=rss,Yahoo Finance,2025-11-23
2025-11-23,MSFT,Top Stocks to Double Up on Right Now,https://www.fool.com/investing/2025/11/22/top-stocks-to-double-up-on-right-now/?.tsrc=rss,Yahoo Finance,2025-11-23
2025-11-23,AAPL,Prediction: These 2 AI Stocks Will Be Worth More Than Apple by Year-End 2026,https://www.fool.com/investing/2025/11/23/predict-ai-stocks-worth-more-than-apple-2026/?.tsrc=rss,Yahoo Finance,2025-11-23
2025-11-23,GOOGL,3 Artificial Intelligence Stocks You Can Buy and Hold for the Next Decade,https://www.fool.com/investing/2025/11/23/3-artificial-intelligence-stocks-to-buy-and-hold/?.tsrc=rss,Yahoo Finance,2025-11-23
2025-11-23,GOOGL,On Running Shoes Won't Be Running Black Friday Deals Despite 'Price-Competitive Environment',https://finance.yahoo.com/news/running-shoes-wont-running-black-210052052.html?.tsrc=rss,Yahoo Finance,2025-11-23
2025-11-23,GOOGL,2 Top Dividend Stocks for Growth-Oriented Investors,https://www.fool.com/investing/2025/11/23/2-top-dividend-stocks-for-growth-oriented-investor/?.tsrc=rss,Yahoo Finance,2025-11-23
2025-11-23,GOOGL,"AI is too risky to insure, say people whose job is insuring risk",https://finance.yahoo.com/news/ai-too-risky-insure-people-174500464.html?.tsrc=rss,Yahoo Finance,2025-11-23
2025-11-23,GOOGL,Alphabet Is Well Positioned for the Next Decade of AI Growth,https://www.fool.com/investing/2025/11/23/alphabet-is-well-positioned-for-the-next-decade-of/?.tsrc=rss,Yahoo Finance,2025-11-23
2025-11-23,GOOGL,"As Google eyes exponential surge in serving capacity, analyst says we’re entering ‘stage two of AI’ where bottlenecks are physical constraints",https://finance.yahoo.com/news/google-eyes-exponential-surge-serving-100300682.html?.tsrc=rss,Yahoo Finance,2025-11-23
2025-11-23,GOOGL,Netflix vs. Alphabet: Which Growth Stock Is a Better Buy?,https://www.fool.com/investing/2025/11/23/netflix-vs-alphabet-which-growth-stock-is-a-better/?.tsrc=rss,Yahoo Finance,2025-11-23
2025-11-22,AAPL,Billionaire Warren Buffett Owns 6 Dow Jones Stocks. Here's My Top Buy for 2026.,https://www.fool.com/investing/2025/11/22/billionaire-warren-buffett-buy-dow-stocks-2026/?.tsrc=rss,Yahoo Finance,2025-11-22
2025-11-22,META,Billionaire Stanley Druckenmiller Just Bought These 3 AI Stocks. Should Investors Follow Suit?,https://www.fool.com/investing/2025/11/22/billionaire-stanley-druckenmiller-just-bought-thes/?.tsrc=rss,Yahoo Finance,2025-11-22
2025-11-22,AAPL,"5 ‘Necessities’ Frugal People Don’t Buy, According to Frugal Living Expert Austin Williams",https://finance.yahoo.com/news/5-necessities-frugal-people-don-150046545.html?.tsrc=rss,Yahoo Finance,2025-11-22
2025-11-22,TSLA,Elon Musk once vowed to ‘own no home.' How to invest in real estate without buying property,https://finance.yahoo.com/news/elon-musk-once-vowed-own-102500613.html?.tsrc=rss,Yahoo Finance,2025-11-22
2025-11-22,AAPL,Where Will Apple Stock Be in 5 Years?,https://www.fool.com/investing/2025/11/22/where-will-apple-stock-be-in-5-years/?.tsrc=rss,Yahoo Finance,2025-11-22
2025-11-22,AAPL,Meta wants to get into the electricity trading business,https://finance.yahoo.com/news/meta-wants-electricity-trading-business-172636761.html?.tsrc=rss,Yahoo Finance,2025-11-22
2025-11-22,TSLA,MarketBeat Week in Review – 11/17 - 11/21,https://www.marketbeat.com/originals/marketbeat-week-in-review-11-17-11-21/?utm_source=yahoofinance&utm_medium=yahoofinance&.tsrc=rss,Yahoo Finance,2025-11-22
2025-11-22,TSLA,How To Put $100 In Your Retirement Fund Each Month With STAG Industrial Stock,https://finance.yahoo.com/news/put-100-retirement-fund-month-130108235.html?.tsrc=rss,Yahoo Finance,2025-11-22
2025-11-22,TSLA,Stock Market Week Ahead: A Trillion-Dollar Shopping Season,https://finance.yahoo.com/m/a97c721b-144e-3701-a6a2-c614b7187dfc/stock-market-week-ahead%3A-a.html?.tsrc=rss,Yahoo Finance,2025-11-22
2025-11-22,TSLA,Prediction: These Stocks Will Join the $3 Trillion Club in 3 Years,https://www.fool.com/investing/2025/11/22/prediction-these-stocks-will-join-the-3-trillion-c/?.tsrc=rss,Yahoo Finance,2025-11-22
2025-11-22,TSLA,What to Know Before Buying Build-A-Bear Stock,https://www.fool.com/investing/2025/11/22/what-to-know-before-buying-build-a-bear-stock/?.tsrc=rss,Yahoo Finance,2025-11-22
2025-11-22,TSLA,"Crypto Market Crash 'A Generational Opportunity For Long Term Investors,' Bitwise Investment Chief Says",https://finance.yahoo.com/news/crypto-market-crash-generational-opportunity-173107724.html?.tsrc=rss,Yahoo Finance,2025-11-22
2025-11-22,TSLA,UFC CEO Dana White Shares How He Became A Billionaire: 'You Have To Keep Proving Yourself Every Year',https://finance.yahoo.com/news/ufc-ceo-dana-white-shares-180056641.html?.tsrc=rss,Yahoo Finance,2025-11-22
2025-11-22,TSLA,Tesla's Roller Coaster Ride Continues With a Warning for Investors,https://www.fool.com/investing/2025/11/22/tesla-roller-coaster-ride-continues-with-warning-f/?.tsrc=rss,Yahoo Finance,2025-11-22
2025-11-22,TSLA,The Hits Keep on Coming for Tesla Investors,https://www.fool.com/investing/2025/11/22/the-hits-keep-on-coming-for-tesla-investors/?.tsrc=rss,Yahoo Finance,2025-11-22
2025-11-22,MSFT,Can Lumen Technologies’ (LUMN) New AI Partnerships Deepen Its Competitive Edge in Enterprise Connectivity?,https://finance.yahoo.com/news/lumen-technologies-lumn-ai-partnerships-221350268.html?.tsrc=rss,Yahoo Finance,2025-11-22
2025-11-22,AMZN,"I Just Retired At 62 With $980K Between My 401(k), Roth IRA, And Brokerage Account—Which Do I Tap First So I Don't Get Crushed on Taxes?",https://finance.yahoo.com/news/just-retired-62-980k-between-210117836.html?.tsrc=rss,Yahoo Finance,2025-11-22
2025-11-22,META,"'It's A Never-Ending Merry-Go-Round,' Says Dave Ramsey As Couple Spends $1,200 On Stockings And $360 On Kids' Books For 12 Adults",https://finance.yahoo.com/news/never-ending-merry-round-says-193127265.html?.tsrc=rss,Yahoo Finance,2025-11-22
